{
  "$schema": "http://json-schema.org/draft-07/schema#",
  "title": "Workflow",
  "type": "object",
  "required": [
    "entryGraphId",
    "graphs",
    "id",
    "name"
  ],
  "properties": {
    "entryGraphId": {
      "type": "string",
      "format": "uuid"
    },
    "graphs": {
      "type": "array",
      "items": {
        "$ref": "#/definitions/Graph"
      }
    },
    "id": {
      "type": "string",
      "format": "uuid"
    },
    "name": {
      "type": "string"
    },
    "with": {
      "type": [
        "object",
        "null"
      ],
      "additionalProperties": true
    }
  },
  "definitions": {
    "Edge": {
      "type": "object",
      "required": [
        "from",
        "fromPort",
        "id",
        "to",
        "toPort"
      ],
      "properties": {
        "from": {
          "type": "string",
          "format": "uuid"
        },
        "fromPort": {
          "type": "string"
        },
        "id": {
          "type": "string",
          "format": "uuid"
        },
        "to": {
          "type": "string",
          "format": "uuid"
        },
        "toPort": {
          "type": "string"
        }
      }
    },
    "Graph": {
      "type": "object",
      "required": [
        "edges",
        "id",
        "name",
        "nodes"
      ],
      "properties": {
        "edges": {
          "type": "array",
          "items": {
            "$ref": "#/definitions/Edge"
          }
        },
        "id": {
          "type": "string",
          "format": "uuid"
        },
        "name": {
          "type": "string"
        },
        "nodes": {
          "type": "array",
          "items": {
            "$ref": "#/definitions/Node"
          }
        }
      }
    },
    "Node": {
      "oneOf": [
        {
          "type": "object",
          "required": [
            "action",
            "id",
            "name",
            "type"
          ],
          "properties": {
            "action": {
              "type": "string"
            },
            "id": {
              "type": "string",
              "format": "uuid"
            },
            "name": {
              "type": "string"
            },
            "type": {
              "type": "string",
              "enum": [
                "action"
              ]
            },
            "with": {
              "type": [
                "object",
                "null"
              ],
              "additionalProperties": true
            }
          }
        },
        {
          "type": "object",
          "required": [
            "id",
            "name",
            "subGraphId",
            "type"
          ],
          "properties": {
            "id": {
              "type": "string",
              "format": "uuid"
            },
            "name": {
              "type": "string"
            },
            "subGraphId": {
              "type": "string",
              "format": "uuid"
            },
            "type": {
              "type": "string",
              "enum": [
                "subGraph"
              ]
            },
            "with": {
              "type": [
                "object",
                "null"
              ],
              "additionalProperties": true
            }
          }
        }
      ]
    }
  }
}
