{
  "id": "99999999-9999-4999-8999-999999999999",
  "name": "E2E Sample Pipeline",
  "entryGraphId": "88888888-8888-4888-8888-888888888888",
  "graphs": [
    {
      "id": "88888888-8888-4888-8888-888888888888",
      "name": "main",
      "nodes": [
        {
          "id": "11111111-1111-4111-8111-111111111111",
          "name": "Create Features",
          "type": "action",
          "action": "Feature Creator",
          "with": {
            "creator": "[#{ name: \"alpha\", value: 10 }, #{ name: \"beta\", value: 25 }, #{ name: \"gamma\", value: 40 }]"
          }
        },
        {
          "id": "22222222-2222-4222-8222-222222222222",
          "name": "Manage Attributes",
          "type": "action",
          "action": "Attribute Manager",
          "with": {
            "operations": [
              {
                "attribute": "doubledValue",
                "method": "create",
                "value": {
                  "type": "flowExpr",
                  "value": "attributes[\"value\"] * 2"
                }
              }
            ]
          }
        },
        {
          "id": "33333333-3333-4333-8333-333333333333",
          "name": "Write Output",
          "type": "action",
          "action": "JSON Writer",
          "with": {
            "output": "file::join_path(env.get(\"workerArtifactPath\"), \"result.json\")"
          }
        }
      ],
      "edges": [
        {
          "id": "aaaaaaaa-1111-4111-8111-aaaaaaaaaaaa",
          "from": "11111111-1111-4111-8111-111111111111",
          "to": "22222222-2222-4222-8222-222222222222",
          "fromPort": "features",
          "toPort": "features"
        },
        {
          "id": "bbbbbbbb-2222-4222-8222-bbbbbbbbbbbb",
          "from": "22222222-2222-4222-8222-222222222222",
          "to": "33333333-3333-4333-8333-333333333333",
          "fromPort": "features",
          "toPort": "features"
        }
      ]
    }
  ]
}
